crawl_date,show_date,show_desc,show_genre,show_id,show_name_imdb,show_rate,show_vote_cnt,similar_show,show_name_netflix
2024-04-06T22:44,2011–2020,"This Chicago-set sitcom follows the intertwined lives of six young urbanites trying to learn the ropes of adulthood. Through breakups and whatever other curve-balls life throws them, the pal...","Comedy,Romance",tt1587678,Happy Endings,7.8,40K,"Don't Trust the B---- in Apartment 23,Cougar Town,The Mindy Project,Suburgatory,Happy Endings: Happy Rides,Single Parents,You're the Worst,30 Rock,Life in Pieces,Unbreakable Kimmy Schmidt,New Girl,The League",Happy Endings
2024-04-06T22:44,2017–2021,Ms. Frizzle and her class along with an inventive high-tech bus that invites children on high-flying hijinks that introduce the incredible world of science.,"Animation,Adventure,Family",tt3869122,The Magic School Bus Rides Again,6.4,926,"The Magic School Bus,The Magic School Bus Rides Again in the Zone,The Magic School Bus Rides Again: Kids in Space,The Magic School Bus Rides Again: The Frizz Connection,Arthur,Annie,Sesame Street,Rookie of the Year,Full House,Bill Nye the Science Guy,Nature Cat,Eureka!",The Magic School Bus Rides Again
2024-04-06T22:44,2020–,"In this travel show, actor Zac Efron journeys around the world with wellness expert Darin Olien in search of healthy, sustainable ways to live.","Documentary,History,Reality-TV",tt12585152,Down to Earth with Zac Efron,8.0,8K,"Limitless,The Great Global Cleanup,Live to 100: Secrets of the Blue Zones,Extremely Wicked, Shockingly Evil and Vile,Unsolved Mysteries,The Greatest Beer Run Ever,Pepsi, Where's My Jet?,Tales by Light,Charlie St. Cloud,Island of the Sea Wolves,Somebody Feed Phil,Explained",Down to Earth with Zac Efron
2024-04-06T22:44,2014–2020,Siblings Miyuki and Tatsuya Shiba are turning the National Magic University Affiliated First High School campus upside down.,"Animation,Action,Drama",tt3874528,The Irregular at Magic High School,7.0,4.1K,"The Irregular at Magic High School: The Girl Who Calls the Stars,The Irregular at Magic High School: Reminiscence Arc,Chivalry of a Failed Knight,Arifureta: From Commonplace to World's Strongest,The Misfit of Demon King Academy,The World's Finest Assassin Gets Reincarnated in Another World as an Aristocrat,The Asterisk War,Wise Man's Grandchild,The Strongest Sage with the Weakest Crest,Death March to the Parallel World Rhapsody,Seirei Gensouki: Spirit Chronicles,Akashic Records of Bastard Magic Instructor",The Irregular at Magic High School
2024-04-06T22:44,2016–2019,"Having gone missing seven years ago, the previously blind Prairie returns home, now in her twenties with her sight restored. While many believe she is a miracle, others worry that she could ...","Drama,Fantasy,Mystery",tt4635282,The OA,7.8,115K,"Sense8,A Murder at the End of the World,Another Earth,Travelers,Maniac,Altered Carbon,Devs,The East,Russian Doll,Sound of My Voice,Archive 81,Raised by Wolves",The OA
2024-04-06T22:44,2016,"A young girl who lives with her cruel stepmother and sister, accidentally meets 3 young and rich cousins who live a luxury life in a big mansion and is hired by the boys grandpa to look afte...","Comedy,Romance",tt5764414,Cinderella and the Four Knights,7.4,5.2K,"Heirs,My Secret Romance,Boys Over Flowers,Her Private Life,My ID Is Gangnam Beauty,Record of Youth,The Bride of Habaek,Because This Is My First Life,Beauty Inside,Oh My Venus,Romance Is a Bonus Book,Strong Girl Bong-soon",Cinderella and the Four Knights
2024-04-06T22:44,2017–,"Mobeen is a 28-year old Brummie Muslim singlehandedly raising his 15-year-old sister. This show documents the struggles of his criminal past, the friendships he has, and the controversies he...",Comedy,tt7639280,Man Like Mobeen,8.0,3.6K,"Man Like Mobeen,Borderline,People Just Do Nothing,Bad Education,The Young Offenders,Man Down,The Cleaner,Sliced,Bloods,Fresh Meat,Friday Night Dinner,Black Ops",Man Like Mobeen
2024-04-06T22:44,2019,A gifted writer who's the youngest editor-in-chief ever at his publishing company gets enmeshed in the life of a former copywriter desperate for a job.,"Comedy,Drama,Romance",tt9130542,Romance Is a Bonus Book,8.0,7.7K,"While You Were Sleeping,Something in the Rain,What's Wrong with Secretary Kim,Her Private Life,W,Hometown Cha-Cha-Cha,Run On,Because This Is My First Life,Pinocchio,Business Proposal,Forecasting Love and Weather,Start-Up",Romance Is a Bonus Book
2024-04-06T22:44,2017–2019,A look at the personal and professional lives of a group of women who perform for a wrestling organization in Los Angeles during the 1980s.,"Comedy,Drama,Sport",tt5770786,GLOW,8.0,50K,"Unbreakable Kimmy Schmidt,Love,Master of None,Russian Doll,GLOW: Gorgeous Ladies of Wrestling,Horse Girl,Atypical,The Kominsky Method,Community,The Good Place,Maniac,Living with Yourself",GLOW
2024-04-06T22:44,2021–,Shen Ruo Xin is a thirty-something professional who decides to take a stand against unfair societal expectations At her workplace she finds herself drawn to two different men - one her trust...,"Drama,Romance",tt14376958,Lizhi pai shenghuo,8.0,850,"Meteor Garden,Miss the Dragon,Love Between Fairy and Devil,Only for Love,Never Give Up,Look Up and See Joy,Find Yourself,Ever Night 2,Well-Intended Love,Wo men de xi nan lian da,Wo qin'ai de 'Xiao jiepi',Do Do Sol Sol La La Sol",Lizhi pai shenghuo
2024-04-06T22:44,2010–,"The same folks gather at the sales of storage units that have been abandoned by their renters. Having no clue what's inside, there are just enough instances where the buyers hit pay dirt to ...",Reality-TV,tt1785123,Storage Wars,6.3,10K,"Pawn Stars,Storage Wars: Texas,American Pickers,Brandi and Jarrod: Married to the Job,Counting Cars,Man vs. Wild,American Restoration,Auction Hunters,Forged in Fire,Shark Tank,Shipping Wars,MythBusters",Storage Wars
2024-04-06T22:44,2002–2010,"Two best friends, Kenny Hotz and Spencer Rice, face each other in various competitions. At the end of each episode, the loser gets humiliated.","Comedy,Game-Show,Reality-TV",tt0384746,Kenny vs. Spenny,8.1,9.9K,"Paldemic,Kenny Hotz's Triumph of the Will,Pitch,The Papal Chase,Testees,Important Things with Demetri Martin,Single White Spenny,On Cinema,Penn & Teller: Bullshit!,BASEketball,Ed vs. Spencer,Jeopardy!",Kenny vs. Spenny
2024-04-06T22:44,2020–2021,"Love is as tough as it is sweet for a lovestruck teenager, whose relationship with her next-door neighbor transforms as they grow into adulthood.","Comedy,Romance",tt13642264,A Love So Beautiful,7.3,1.7K,"A Love So Beautiful,My First First Love,Run On,Love Alarm,My ID Is Gangnam Beauty,Meteor Garden,Nevertheless,,Once Upon a Small Town,Cinderella and the Four Knights,Our Beloved Summer,Business Proposal,Do Do Sol Sol La La Sol",A Love So Beautiful
2024-04-06T22:44,2018–2020,Newspaper illustrator John Moore meets with criminal psychologist (alienist) Dr. Laszlo Kreizler to investigate a serial killer in New York during the late 19th century.,"Crime,Drama,Mystery",tt4604612,The Alienist,7.7,60K,"Alias Grace,The Sinner,Taboo,Freud,Penny Dreadful,The Alienist,The Chestnut Man,Manhunt,The Serpent,Mindhunter,Ripper Street,1899",The Alienist
2024-04-06T22:44,2016–2023,"Grizzy and the Lemmings are in a protracted conflict over the possession and ownership of ""Yummy"" a chocolate-hazelnut spread that looks like Nutella. Many foibles ensue.","Animation,Adventure,Comedy",tt6717058,Grizzy and the Lemmings,7.2,909,"Zig & Sharko,Masha and the Bear,Larva,The Tom and Jerry Show,PJ Masks,Bunnicula,The Daltons,The Garfield Show,Shaun the Sheep,Rabbids Invasion,The Oddbods Show,New Looney Tunes",Grizzy and the Lemmings
2024-04-06T22:44,2018–2020,"After a brutal virus wipes out most of the population, two young siblings embark on a perilous search for safety.","Drama,Sci-Fi,Thriller",tt6656238,The Rain,6.3,41K,"Into the Night,3%,The Society,The 100,Snowpiercer,Tribes of Europa,Katla,How to Sell Drugs Online (Fast),13 Reasons Why,To the Lake,Biohackers,Elite",The Rain
2024-04-06T22:44,2004–2006,A continuation of the Justice League animated series finds the original members of the team joined in their battle against crime and evil by dozens of other heroes from the DC comics univers...,"Animation,Action,Adventure",tt6025022,Justice League Unlimited,8.7,20K,"Justice League,Superman: The Animated Series,The New Batman Adventures,Batman: The Animated Series,Teen Titans,Batman: The Brave and the Bold,Spider-Man: The Animated Series,Static Shock,The Batman,Batman: Mask of the Phantasm,The Batman Superman Movie: World's Finest,The Spectacular Spider-Man",Justice League Unlimited
2024-04-06T22:44,2014–2016,"Set on the streets of 17th-century Paris, ""The Musketeers"" gives a contemporary take on the classic story about a group of highly trained soldiers and bodyguards assigned to protect King and...","Adventure,Drama",tt2733252,The Musketeers,7.8,24K,"Merlin,The Three Musketeers,Da Vinci's Demons,Robin Hood,Ripper Street,The Three Musketeers,The Three Musketeers,The Three Musketeers,The Three Musketeers - Part I: D'Artagnan,The Musketeer,Black Sails,Emerald City",The Musketeers
2024-04-06T22:44,2022–,"Skilled cake artists create mouthwatering replicas of everyday objects, in a mind-bending baking contest inspired by a popular meme.","Game-Show,Reality-TV",tt18314214,Is It Cake?,6.0,4K,"Baking Impossible,Sugar Rush,Nailed It!,Bake Squad,School of Chocolate,Terminator: Termination,Snack vs. Chef,Cook at All Costs,Crazy Delicious,Floor Is Lava,Sugar Rush Christmas,Zumbo's Just Desserts",Is It Cake?
2024-04-06T22:44,2011–2022,"Red and Yellow, two larva, get into many silly situations everywhere they go.","Animation,Short,Adventure",tt6966158,Larva,7.1,852,"Larva Island,The Larva Island Movie,Larva Pendant,Larva Family,Zig & Sharko,Bernard,Grizzy and the Lemmings,Shaun the Sheep,Masha and the Bear,Angry Birds Toons,Pink Panther & Pals,Mr. Bean: The Animated Series",Larva
2024-04-06T22:44,1989–,Viewers from around America send in home videos with comedic moments.,"Comedy,Family,Reality-TV",tt0098740,America's Funniest Home Videos,6.1,5.7K,"Wipeout,Wheel of Fortune,Bill Nye the Science Guy,Blue's Clues,Deal or No Deal,America's Funniest Videos: Animal Edition,The Price is Right,VeggieTales,Shark Tank,Mister Rogers' Neighborhood,America's Funniest People,Speed Racer",America's Funniest Home Videos
2024-04-06T22:44,2007–2024,"Phineas and Ferb invent, scheme, and stay one step ahead of their bratty sister. Meanwhile, their pet platypus plots against evil Dr. Doofenshmirtz.","Animation,Short,Action",tt0852863,Phineas and Ferb,8.1,56K,"The Fairly OddParents,SpongeBob SquarePants,The Amazing World of Gumball,Phineas and Ferb the Movie: Across the 2nd Dimension,Ben 10,Kim Possible,The Powerpuff Girls,Courage the Cowardly Dog,Dexter's Laboratory,Gravity Falls,Teen Titans,Phineas and Ferb the Movie: Candace Against the Universe",Phineas and Ferb
2024-04-06T22:44,2017–2024,"Shaun Murphy, a young surgeon with autism and Savant syndrome, is recruited into the surgical unit of a prestigious hospital.",Drama,tt6470478,The Good Doctor,8.0,112K,"New Amsterdam,Chicago Fire,House,Chicago Med,The Big Bang Theory,Young Sheldon,Good Doctor,Suits,9-1-1,9-1-1: Lone Star,The Rookie,Chicago P.D.",The Good Doctor
2024-04-06T22:44,2016–2018,"In the wake of a mysterious alien invasion, a family fights to stay together in a new world order.","Action,Adventure,Drama",tt4209256,Colony,7.3,39K,"Falling Skies,Revolution,Terra Nova,Continuum,Travelers,Defiance,Under the Dome,V,Dark Matter,12 Monkeys,The Last Ship,The Colony",Colony
2024-04-06T22:44,2018–2020,"A Netflix Original Series documenting various stories about exposing the greed, corruption, and crime spreading through the global economy.","Documentary,Crime",tt7889220,Dirty Money,8.1,10K,"The Pharmacist,Madoff: The Monster of Wall Street,Wild Wild Country,The Great Hack,Rotten,Money, Explained,Explained,Inside Job,Fyre,Inside Bill's Brain: Decoding Bill Gates,The Social Dilemma,Eat the Rich: The GameStop Saga",Dirty Money
2024-04-06T22:44,2011–2023,"When one of their number disappears on the same day that an American girl joins their ranks, a group of English boarding school students embarks on solving a mystery.","Adventure,Drama,Family",tt1638319,House of Anubis,7.3,5.4K,"Het huis Anubis,Victorious,Big Time Rush,H2O: Just Add Water,Every Witch Way,Wolfblood,iCarly,True Jackson, VP,Wizards of Waverly Place,Sonny with a Chance,Drake & Josh,Sam & Cat",House of Anubis
2024-04-06T22:44,2009–2011,"About Cal Lightman, the world's leading deception expert who studies facial expressions and involuntary body language to expose the truth behind the lies.","Crime,Drama,Mystery",tt1235099,Lie to Me,8.0,128K,"The Mentalist,White Collar,Elementary,Castle,Person of Interest,Lie to Me: In Character with Tim Roth,Bones,Scorpion,Forever,Limitless,Numb3rs,Blindspot",Lie to Me
2024-04-06T22:44,2019,"Set in the early 19th century. Goo Hae Ryung works as a historian. Female historians like Goo Hae Ryung are generally looked down upon because of their gender. Yet, Goo Hae Ryung fulfills he...","Comedy,Drama,History",tt10406128,Rookie Historian Goo Hae-Ryung,8.1,3.1K,"My ID Is Gangnam Beauty,The King's Affection,Run On,Love in the Moonlight,100 Days My Prince,Captivating the King,The Bride of Habaek,True Beauty,Romance Is a Bonus Book,Soul Plate,A Good Day to Be a Dog,Yeopgijeogin Geunyeo",Rookie Historian Goo Hae-Ryung
2024-04-06T22:44,2012–2013,Chloe is a New York party girl with the morals of a pirate. She causes trouble for her best friend James Van Der Beek and her naive small-town roommate June.,Comedy,tt1819509,Don't Trust the B---- in Apartment 23,7.3,40K,"Happy Endings,2 Broke Girls,Unbreakable Kimmy Schmidt,Suburgatory,Jessica Jones,Cougar Town,New Girl,Dollface,Leave My Friends Alone,Santa Clarita Diet,Superstore,The Good Place",Don't Trust the B---- in Apartment 23
2024-04-06T22:44,2010–,"A users guide to the cosmos from the big bang to galaxies, stars, planets and moons. Where did it all come from and how does it all fit together. A primer for anyone who has ever looked up a...",Documentary,tt1832668,How the Universe Works,8.9,7.2K,"How the Universe Works,Through the Wormhole,The Universe,Into the Universe with Stephen Hawking,The Planets,Cosmos: A Spacetime Odyssey,Space's Deepest Secrets,The Proof is Out There,Universe,Killers of the Cosmos,How It's Made,Cosmos",How the Universe Works
2024-04-06T22:44,2015–2019,A mighty warrior and a young boy with supernatural powers search for enlightenment in a ruthless post-apocalyptic America controlled by feudal barons.,"Action,Adventure,Drama",tt3865236,Into the Badlands,7.9,50K,"Warrior,Defiance,Marco Polo,The Shannara Chronicles,Falling Skies,Wu Assassins,The Strain,Vsauce3: Into the Badlands,Iron Fist,The Gifted,Black Sails,Preacher",Into the Badlands
2024-04-06T22:44,1997–,"Follows the misadventures of four irreverent grade-schoolers in the quiet, dysfunctional town of South Park, Colorado.","Animation,Comedy",tt0121955,South Park,8.7,405K,"The Simpsons,Family Guy,Futurama,South Park: Bigger, Longer & Uncut,Rick and Morty,South Park: Joining the Panderverse,South Park (Not Suitable for Children),BoJack Horseman,American Dad!,Archer,Seinfeld,Chappelle's Show",South Park
2024-04-06T22:44,2020–,It is a new type of history show for a new type of audience: Big History delivered in an unadulterated hit of premium archive and jaw-dropping infographics.,"Documentary,History",tt11958648,History 101,6.8,4.8K,"Explained,Money, Explained,The Mind, Explained,Sex, Explained,The Future Of,How to Become a Tyrant,Coronavirus, Explained,Human: The World Within,History of Swear Words,High Score,Inside Bill's Brain: Decoding Bill Gates,Headspace Guide to Meditation",History 101
2024-04-06T22:44,2001–2004,"Nick Fallin is a hotshot lawyer working at his father's ultrasuccessful Pittsburgh law firm. Unfortunately, the high life has gotten the best of Nick.","Crime,Drama",tt0285370,The Guardian,7.4,5.9K,"The Mentalist,Judging Amy,Shark,The Guardian,Sex and Death 101,Frankie,Bull,Instinct,Crossing Jordan,The Good Wife,JAG,High Ground",The Guardian
2024-04-06T22:44,2019–2022,A cynical young woman in New York City keeps dying and returning to the party that's being thrown in her honor on that same evening. She tries to find a way out of this strange time loop.,"Comedy,Drama,Mystery",tt7520794,Russian Doll,7.7,107K,"The Good Place,Poker Face,Maniac,The End of the F***ing World,Orange Is the New Black,Dead to Me,The Umbrella Academy,Killing Eve,Santa Clarita Diet,Atypical,Unbreakable Kimmy Schmidt,Ratched",Russian Doll
2024-04-06T22:44,2009–2014,"Shinya Shokudo is a tv series from Japan since 2009. It tells many stories about ordinary people eat in shinya shokudo, which means a restaurant at midnight. This small restaurant opens from...",Drama,tt1882928,Midnight Diner,8.6,3.1K,"Midnight Diner: Tokyo Stories,Midnight Diner,Midnight Diner 2,Midnight Diner,Samurai Gourmet,Late Night Restaurant,The Makanai: Cooking for the Maiko House,Midnight Dinner,The Solitary Gourmet,Midnight Food Store,Kantaro: The Sweet Tooth Salaryman,1,000,000 yen no Onnatachi",Midnight Diner
2024-04-06T22:44,2018–2020,"She-Ra, Princess of Power, leads a rebellion to free her land of Etheria from the monstrous invaders the Horde.","Animation,Action,Adventure",tt7745956,She-Ra and the Princesses of Power,8.1,19K,"The Owl House,Kipo and the Age of Wonderbeasts,The Dragon Prince,She-Ra: Princess of Power,Steven Universe,Amphibia,Infinity Train,Star vs. the Forces of Evil,The Legend of Korra,Hilda,Steven Universe Future,Gravity Falls",She-Ra and the Princesses of Power
2024-04-06T22:44,2020–,"Teams compete to navigate rooms flooded with lava by leaping from chairs, hanging from curtains and swinging from chandeliers.",Game-Show,tt12370124,Floor Is Lava,5.3,2.9K,"Baking Impossible,Ultimate Beastmaster,Sugar Rush,Is It Cake?,Bullsh*t: The Game Show,The Floor Is Lava,Awake: The Million Dollar Game,Nailed It!,Blown Away: Christmas,Bake Squad,The Circle,Sugar Rush Christmas",Floor Is Lava
2024-04-06T22:44,2015–2019,A live-action sitcom about two 12-year-old girls who start a multi-million-dollar gaming company and take on rap superstar Double G as a business partner.,"Comedy,Family",tt4711184,Game Shakers,4.5,3.2K,"Henry Danger,Nicky, Ricky, Dicky & Dawn,The Thundermans,Sam & Cat,The Haunted Hathaways,School of Rock,Danger Force,100 Things to Do Before High School,Victorious,iCarly,Bella and the Bulldogs,The Loud House",Game Shakers
2024-04-06T22:44,2019,"In this interactive series, you'll make key decisions to help Bear Grylls survive, thrive and complete missions in the harshest environments on Earth.","Adventure,Reality-TV",tt10044952,You vs. Wild,6.6,2.9K,"You vs. Wild: Out Cold,Animals on the Loose: A You vs. Wild Movie,Man vs. Wild,The Island with Bear Grylls,Transformers: Cyberverse,Transformers: The Headmasters,Magic for Humans,Headspace Guide to Meditation,Bear Grylls: Mission Survive,Survivor Games with Bear Grylls,MythBusters,I Survived Bear Grylls",You vs. Wild
2024-04-06T22:44,2019,"An existential comedy about a man struggling in life who undergoes a new treatment to become a better person, only to find that he's been replaced by a new and improved version of himself.","Comedy,Drama,Sci-Fi",tt8880894,Living with Yourself,7.2,35K,"Maniac,The Fundamentals of Caring,Russian Doll,Friends from College,Space Force,Master of None,This Way Up,Love,The Kominsky Method,The Woman in the House Across the Street from the Girl in the Window,Dead to Me,Unbreakable Kimmy Schmidt",Living with Yourself
2024-04-06T22:44,2020–,"Obsessed gamer Arisu suddenly finds himself in a strange, emptied-out version of Tokyo in which he and his friends must compete in dangerous games in order to survive.","Action,Drama,Mystery",tt10795658,Alice in Borderland,7.7,96K,"All of Us Are Dead,Squid Game,Sweet Home,Alice in Borderland,My Name,Kingdom,Money Heist,Hellbound,The Glory,Wednesday,Girl From Nowhere,Stranger Things",Alice in Borderland
2024-04-06T22:44,2019–2021,"In a world where an app alerts people if someone in the vicinity likes them, Kim Jojo experiences young love while coping with personal adversities.","Comedy,Drama,Romance",tt9145880,Love Alarm,6.6,7.6K,"Nevertheless,,Forecasting Love and Weather,My First First Love,Navillera,Business Proposal,Love Alarm Clap! Clap! Clap!,True Beauty,When the Devil Calls Your Name,My Holo Love,My ID Is Gangnam Beauty,Run On,Romance Is a Bonus Book",Love Alarm
2024-04-06T22:44,2020,An American astronaut struggles with leaving her husband and daughter behind to embark on a dangerous mission with an international space crew.,"Drama,Romance,Sci-Fi",tt8787802,Away,6.6,26K,"Another Life,Salvation,Trial by Fire,The Midnight Sky,I Am Mother,Silas,The Suck,The Silent Sea,Into the Night,Soul ReViver,Colony,Leaving Normal",Away
2024-04-06T22:44,2019–2021,"In the dark, early days of a zombie apocalypse, complete strangers band together to find the strength they need to survive and get back to loved ones.","Action,Drama,Horror",tt8923854,Black Summer,6.6,34K,"Z Nation,Black Summer,All of Us Are Dead,Daybreak,Into the Night,Kingdom,The Rain,Reality Z,To the Lake,Fear the Walking Dead,Resident Evil,Black Summer",Black Summer
2024-04-06T22:44,2020–2022,A comedic look at a couple facing various challenges in their daily lives while trying to cope with their changes from twenties to thirties.,"Animation,Action,Adventure",tt6994156,Close Enough,7.8,13K,"Inside Job,Final Space,Final Space,Solar Opposites,The Midnight Gospel,F Is for Family,Disenchantment,Mordecai and Rigby: Ringtoneers,Paradise PD,Regular Show,Big Mouth,Human Resources",Close Enough
2024-04-06T22:44,2019–,The elite real estate brokers at The Oppenheim Group sell the luxe life to affluent buyers in LA. The drama ramps up when a new agent joins the team.,Reality-TV,tt9817298,Selling Sunset,6.5,8.1K,"Selling the OC,Selling Tampa,Buying Beverly Hills,The Kardashians,Love Is Blind,Cráter,Bling Empire,The Real Housewives of Beverly Hills,The Ultimatum: Marry or Move On,Queer Eye,Too Hot to Handle,Selling the Hamptons",Selling Sunset
2024-04-06T22:44,2005–2012,"When a suburban mother turns to dealing marijuana in order to maintain her privileged lifestyle after her husband dies, she finds out just how addicted her entire neighborhood already is.","Comedy,Crime,Drama",tt0439100,Weeds,7.9,117K,"Californication,Entourage,Orange Is the New Black,That '70s Show,30 Rock,Ray Donovan,Scrubs,Nurse Jackie,True Blood,Eastbound & Down,Unbreakable Kimmy Schmidt,The Fresh Prince of Bel-Air",Weeds
2024-04-17T16:44,2011–2021,"A scrappy, feisty, fiercely loyal Chicago family makes no apologies.","Comedy,Drama",tt1586680,Shameless,8.5,284K,"Breaking Bad,Friends,Stranger Things,Euphoria,Suits,The Office,The Boys,Game of Thrones,The Walking Dead,The Big Bang Theory,House,Modern Family",Shameless (U.S.)
2024-04-17T16:44,2009–2023,Covert black ops and espionage take a back seat to zany personalities and relationships between secret agents and drones.,"Animation,Action,Comedy",tt1486217,Archer,8.6,166K,"Futurama,South Park,Arrested Development,The Simpsons,Bob's Burgers,Rick and Morty,It's Always Sunny in Philadelphia,BoJack Horseman,Community,Parks and Recreation,Chappelle's Show,American Dad!",Archer
2024-04-17T16:44,2005–,"Budding entrepreneurs, inventors, and small businessmen pitch their ideas to five ""dragons""--real-life business leaders and millionaires.","Game-Show,Reality-TV",tt0443370,Dragons' Den,6.9,2.5K,"The Apprentice UK,The Chase,Who Wants to Be a Millionaire,Dragons' Den,I'm a Celebrity, Get Me Out of Here!,Come Dine with Me,Pointless,Ant & Dec's Saturday Night Takeaway,Michael McIntyre's Big Show,Gogglebox,The Wheel,The Graham Norton Show",Dragons' Den
2024-04-17T16:44,2019–,Docuseries following the FIA Formula One World Championship across multiple seasons.,"Documentary,Sport",tt8289930,Formula 1: Drive to Survive,8.5,51K,"The Grand Tour,Top Gear,Schumacher,Clarkson's Farm,The Last Dance,Formula 1,Beckham,Full Swing,Greatest Events of WWII in Colour,Break Point,The Simpsons,Planet Earth II",Formula 1
2024-04-17T16:44,2007–2017,"Naruto Uzumaki, is a loud, hyperactive, adolescent ninja who constantly searches for approval and recognition, as well as to become Hokage, who is acknowledged as the leader and strongest of...","Animation,Action,Adventure",tt0988824,Naruto: Shippuden,8.7,168K,"Naruto,Death Note,Hunter x Hunter,Jujutsu Kaisen,Demon Slayer: Kimetsu no Yaiba,Attack on Titan,Dragon Ball Z,Boruto: Naruto Next Generations,Bleach,One Piece,Vinland Saga,Bleach: Thousand-Year Blood War",Naruto Shippuden
2024-04-17T16:44,2014–2019,"A young, devout Catholic woman discovers that she was accidentally artificially inseminated.",Comedy,tt3566726,Jane the Virgin,7.9,59K,"Pretty Little Liars,Ginny & Georgia,Gossip Girl,Never Have I Ever,New Girl,The Good Place,Bridgerton,Gilmore Girls,Emily in Paris,Good Girls,Juana la virgen,Queen Charlotte: A Bridgerton Story",Jane The Virgin
2024-04-17T16:44,2014–2020,A group of ambitious law students and their brilliant criminal defense professor become involved in a twisted murder plot that promises to change the course of their lives.,"Crime,Drama,Mystery",tt3205802,How to Get Away with Murder,8.1,166K,"13 Reasons Why,You,Orange Is the New Black,Pretty Little Liars,Scandal,Gossip Girl,Sex Education,Emily in Paris,Good Girls,Money Heist,Ginny & Georgia,Bridgerton",How to Get Away With Murder
